{
  "schema_version": "cloud-bootstrap-session.v1",
  "id": "00000000-0000-4000-8000-000000000101",
  "provider": "aws",
  "target": {
    "provider": "aws",
    "account_id": "123456789012",
    "region": "eu-central-1"
  },
  "entry_point": "settings",
  "twin_id": null,
  "display_name": "Thesis AWS deployment access",
  "revision": 4,
  "state": "ready",
  "guide_digest": "sha256:aaaaaaaaaaaaaaaaaaaaaaaaaaaaaaaaaaaaaaaaaaaaaaaaaaaaaaaaaaaaaaaa",
  "bootstrap_authority_pack": {
    "id": "bootstrap.aws.admin-v1",
    "version": "1",
    "digest": "sha256:bbbbbbbbbbbbbbbbbbbbbbbbbbbbbbbbbbbbbbbbbbbbbbbbbbbbbbbbbbbbbbbb"
  },
  "generated_deployment_pack": {
    "id": "aws.thesis-demo-v2",
    "version": "thesis-demo-v2",
    "digest": "sha256:cccccccccccccccccccccccccccccccccccccccccccccccccccccccccccccccc"
  },
  "credential_origin": "dedicated_disposable",
  "disposal_status": "revoked",
  "credential_expires_at": null,
  "safe_credential_identifier": "AKIA...MPLE",
  "finding": null,
  "connection": {
    "id": "00000000-0000-4000-8000-000000000102",
    "provider": "aws",
    "purpose": "deployment",
    "display_name": "Thesis AWS deployment access",
    "cloud_scope": {
      "account_id": "123456789012",
      "region": "eu-central-1"
    },
    "permission_set_version": "thesis-demo-v2",
    "validation_status": "valid"
  },
  "command_permissions": [],
  "created_at": "2026-08-04T18:00:00Z",
  "updated_at": "2026-08-04T18:01:00Z"
}
